[
   {
      "attempt" : 1,
      "basis_refs" : [
         {
            "id" : "motor-v9",
            "rel" : "applied",
            "type" : "policy"
         },
         {
            "id" : "CL-71",
            "rel" : "assessed",
            "type" : "claim"
         }
      ],
      "data_class" : "personal",
      "decide_seconds" : 4,
      "decided_at" : "2026-09-02T09:07:00Z",
      "decided_by" : "CLM-staff-02",
      "decision_automation" : "fully",
      "decision_id" : "CLM-0001",
      "detected_automatically" : "yes",
      "outcome" : "accepted",
      "reason_class" : "conformed",
      "reason_code" : "within_policy",
      "standard_set_at" : "2026-08-15T00:00:00Z",
      "task_id" : "CLM-T0001",
      "task_type" : "claims.assessment",
      "worker_kind" : "deterministic_code"
   },
   {
      "attempt" : 1,
      "basis_refs" : [
         {
            "id" : "motor-v9",
            "rel" : "applied",
            "type" : "policy"
         },
         {
            "id" : "CL-72",
            "rel" : "assessed",
            "type" : "claim"
         }
      ],
      "data_class" : "personal",
      "decide_seconds" : 4,
      "decided_at" : "2026-09-03T10:14:00Z",
      "decided_by" : "CLM-staff-03",
      "decision_automation" : "fully",
      "decision_id" : "CLM-0002",
      "detected_automatically" : "yes",
      "outcome" : "accepted",
      "reason_class" : "conformed",
      "reason_code" : "within_policy",
      "standard_set_at" : "2026-08-15T00:00:00Z",
      "task_id" : "CLM-T0002",
      "task_type" : "claims.assessment",
      "worker_kind" : "deterministic_code"
   },
   {
      "attempt" : 1,
      "basis_refs" : [
         {
            "id" : "motor-v9",
            "rel" : "applied",
            "type" : "policy"
         },
         {
            "id" : "CL-73",
            "rel" : "assessed",
            "type" : "claim"
         }
      ],
      "data_class" : "personal",
      "decide_seconds" : 4,
      "decided_at" : "2026-09-04T11:21:00Z",
      "decided_by" : "CLM-staff-04",
      "decision_automation" : "fully",
      "decision_id" : "CLM-0003",
      "detected_automatically" : "yes",
      "outcome" : "accepted",
      "reason_class" : "conformed",
      "reason_code" : "within_policy",
      "standard_set_at" : "2026-08-15T00:00:00Z",
      "task_id" : "CLM-T0003",
      "task_type" : "claims.assessment",
      "worker_kind" : "deterministic_code"
   },
   {
      "attempt" : 1,
      "basis_refs" : [
         {
            "id" : "motor-v9",
            "rel" : "applied",
            "type" : "policy"
         },
         {
            "id" : "CL-74",
            "rel" : "assessed",
            "type" : "claim"
         }
      ],
      "data_class" : "personal",
      "decide_seconds" : 4,
      "decided_at" : "2026-09-05T12:28:00Z",
      "decided_by" : "CLM-staff-05",
      "decision_automation" : "fully",
      "decision_id" : "CLM-0004",
      "detected_automatically" : "yes",
      "outcome" : "accepted",
      "reason_class" : "conformed",
      "reason_code" : "within_policy",
      "standard_set_at" : "2026-08-15T00:00:00Z",
      "task_id" : "CLM-T0004",
      "task_type" : "claims.assessment",
      "worker_kind" : "deterministic_code"
   },
   {
      "attempt" : 1,
      "basis_refs" : [
         {
            "id" : "motor-v9",
            "rel" : "applied",
            "type" : "policy"
         },
         {
            "id" : "CL-75",
            "rel" : "assessed",
            "type" : "claim"
         }
      ],
      "data_class" : "personal",
      "decide_seconds" : 4,
      "decided_at" : "2026-09-06T13:35:00Z",
      "decided_by" : "CLM-staff-06",
      "decision_automation" : "fully",
      "decision_id" : "CLM-0005",
      "detected_automatically" : "yes",
      "outcome" : "accepted",
      "reason_class" : "conformed",
      "reason_code" : "within_policy",
      "standard_set_at" : "2026-08-15T00:00:00Z",
      "task_id" : "CLM-T0005",
      "task_type" : "claims.assessment",
      "worker_kind" : "deterministic_code"
   },
   {
      "attempt" : 1,
      "basis_refs" : [
         {
            "id" : "motor-v9",
            "rel" : "applied",
            "type" : "policy"
         },
         {
            "id" : "CL-76",
            "rel" : "assessed",
            "type" : "claim"
         }
      ],
      "data_class" : "personal",
      "decide_seconds" : 4,
      "decided_at" : "2026-09-07T14:42:00Z",
      "decided_by" : "CLM-staff-01",
      "decision_automation" : "fully",
      "decision_id" : "CLM-0006",
      "detected_automatically" : "yes",
      "outcome" : "accepted",
      "reason_class" : "conformed",
      "reason_code" : "within_policy",
      "standard_set_at" : "2026-08-15T00:00:00Z",
      "task_id" : "CLM-T0006",
      "task_type" : "claims.assessment",
      "worker_kind" : "deterministic_code"
   },
   {
      "attempt" : 1,
      "basis_refs" : [
         {
            "id" : "motor-v9",
            "rel" : "applied",
            "type" : "policy"
         },
         {
            "id" : "CL-77",
            "rel" : "assessed",
            "type" : "claim"
         }
      ],
      "data_class" : "personal",
      "decide_seconds" : 38,
      "decided_at" : "2026-09-08T15:49:00Z",
      "decided_by" : "CLM-staff-02",
      "decision_automation" : "partially",
      "decision_id" : "CLM-0007",
      "detected_automatically" : "no",
      "model_id" : "house-assist-2026-03",
      "outcome" : "accepted",
      "proposed_outcome" : "accepted",
      "reason_class" : "conformed",
      "reason_code" : "within_policy",
      "standard_set_at" : "2026-08-15T00:00:00Z",
      "task_id" : "CLM-T0007",
      "task_type" : "claims.assessment",
      "worker_kind" : "person_with_agent"
   },
   {
      "attempt" : 1,
      "basis_refs" : [
         {
            "id" : "motor-v9",
            "rel" : "applied",
            "type" : "policy"
         },
         {
            "id" : "CL-78",
            "rel" : "assessed",
            "type" : "claim"
         }
      ],
      "data_class" : "personal",
      "decide_seconds" : 38,
      "decided_at" : "2026-09-09T16:56:00Z",
      "decided_by" : "CLM-staff-03",
      "decision_automation" : "partially",
      "decision_id" : "CLM-0008",
      "detected_automatically" : "no",
      "model_id" : "house-assist-2026-03",
      "outcome" : "accepted",
      "proposed_outcome" : "accepted",
      "reason_class" : "conformed",
      "reason_code" : "within_policy",
      "standard_set_at" : "2026-08-15T00:00:00Z",
      "task_id" : "CLM-T0008",
      "task_type" : "claims.assessment",
      "worker_kind" : "person_with_agent"
   },
   {
      "attempt" : 1,
      "basis_refs" : [
         {
            "id" : "motor-v9",
            "rel" : "applied",
            "type" : "policy"
         },
         {
            "id" : "CL-79",
            "rel" : "assessed",
            "type" : "claim"
         }
      ],
      "data_class" : "personal",
      "decide_seconds" : 38,
      "decided_at" : "2026-09-10T08:03:00Z",
      "decided_by" : "CLM-staff-04",
      "decision_automation" : "partially",
      "decision_id" : "CLM-0009",
      "detected_automatically" : "no",
      "model_id" : "house-assist-2026-03",
      "outcome" : "accepted",
      "proposed_outcome" : "accepted",
      "reason_class" : "conformed",
      "reason_code" : "within_policy",
      "standard_set_at" : "2026-08-15T00:00:00Z",
      "task_id" : "CLM-T0009",
      "task_type" : "claims.assessment",
      "worker_kind" : "person_with_agent"
   },
   {
      "attempt" : 1,
      "basis_refs" : [
         {
            "id" : "motor-v9",
            "rel" : "applied",
            "type" : "policy"
         },
         {
            "id" : "CL-710",
            "rel" : "assessed",
            "type" : "claim"
         }
      ],
      "data_class" : "personal",
      "decide_seconds" : 95,
      "decided_at" : "2026-09-11T09:10:00Z",
      "decided_by" : "CLM-staff-05",
      "decision_automation" : "partially",
      "decision_id" : "CLM-0010",
      "detected_automatically" : "no",
      "model_id" : "house-assist-2026-03",
      "outcome" : "rejected",
      "proposed_outcome" : "rejected",
      "reason_class" : "evidence_insufficient",
      "reason_code" : "documentation_incomplete",
      "standard_set_at" : "2026-08-15T00:00:00Z",
      "task_id" : "CLM-T0010",
      "task_type" : "claims.assessment",
      "worker_kind" : "person_with_agent"
   },
   {
      "attempt" : 1,
      "basis_refs" : [
         {
            "id" : "motor-v9",
            "rel" : "applied",
            "type" : "policy"
         },
         {
            "id" : "CL-711",
            "rel" : "assessed",
            "type" : "claim"
         }
      ],
      "data_class" : "personal",
      "decide_seconds" : 95,
      "decided_at" : "2026-09-12T10:17:00Z",
      "decided_by" : "CLM-staff-06",
      "decision_automation" : "partially",
      "decision_id" : "CLM-0011",
      "detected_automatically" : "no",
      "model_id" : "house-assist-2026-03",
      "outcome" : "rejected",
      "proposed_outcome" : "rejected",
      "reason_class" : "evidence_insufficient",
      "reason_code" : "documentation_incomplete",
      "standard_set_at" : "2026-08-15T00:00:00Z",
      "task_id" : "CLM-T0011",
      "task_type" : "claims.assessment",
      "worker_kind" : "person_with_agent"
   },
   {
      "attempt" : 1,
      "basis_refs" : [
         {
            "id" : "motor-v9",
            "rel" : "applied",
            "type" : "policy"
         },
         {
            "id" : "CL-712",
            "rel" : "assessed",
            "type" : "claim"
         }
      ],
      "data_class" : "personal",
      "decide_seconds" : 95,
      "decided_at" : "2026-09-13T11:24:00Z",
      "decided_by" : "CLM-staff-01",
      "decision_automation" : "partially",
      "decision_id" : "CLM-0012",
      "detected_automatically" : "no",